<?xml version="1.0" encoding="UTF-8"?>
<Library xmlns:xsd="http://www.w3.org/2001/XMLSchema-instance" xsd:noNamespaceSchemaLocation="../lab-xsds/lab8.xsd">
    <Books>
        <Book id="book1">
            <Shelf number="1">
                <Genre>Fantasy</Genre>
                <Theme>Adventure</Theme>
            </Shelf>
            <Authors>
                <Author>
                    <FirstName>Tove</FirstName>
                    <LastName>Jansson</LastName>
                </Author>
            </Authors>
            <Title>Comet in Moominland</Title>
            <EditedBy>Sort of Books</EditedBy>
            <TotalCopies>8</TotalCopies>
            <CopiesIssued>3</CopiesIssued>
        </Book>
        <Book id="book2">
            <Shelf number="2">
                <Genre>Romance</Genre>
                <Theme>Love</Theme>
            </Shelf>
            <Authors>
                <Author>
                    <FirstName>Jane</FirstName>
                    <LastName>Austen</LastName>
                </Author>
            </Authors>
            <Title>Pride and Prejudice</Title>
            <EditedBy>Union Square and Co.</EditedBy>
            <TotalCopies>12</TotalCopies>
            <CopiesIssued>7</CopiesIssued>
        </Book>
    </Books>
</Library>
